{
  "contractVersion": "1.0.0",
  "id": "desktop.portable-stdio",
  "name": "Portable desktop bridge",
  "backend": "stdio-bridge",
  "platform": "any",
  "executionLocation": "local",
  "transport": {
    "command": "q1x-desktop-bridge",
    "args": [],
    "timeoutMs": 30000,
    "maxOutputBytes": 4194304
  },
  "applicationPolicy": {
    "allowedApplications": ["example.app"]
  },
  "outputDir": "./desktop-output",
  "metadata": {
    "protocol": "q1x-desktop-bridge/1"
  }
}
